<?xml version="1.0" encoding="UTF-8"?>
<sorters xmlns="http://www.tvtrip.com/smaug/SearchReference"
        xmlns:xsi="http://www.w3.org/2001/XMLSchema-instance"
        xsi:schemaLocation="http://www.tvtrip.com/smaug/SearchReference ../xsd/SearchReference.xsd ">

        <sorter>
                <fieldName>price</fieldName>
                <ascending>true</ascending>
                <urlCode>i</urlCode>
        </sorter>
        <sorter>
                <fieldName>price</fieldName>
                <ascending>false</ascending>
                <urlCode>j</urlCode>
        </sorter>
        <sorter>
                <fieldName>ranking</fieldName>
                <ascending>true</ascending>
                <urlCode>q</urlCode>
        </sorter>
        <sorter>
                <fieldName>ranking</fieldName>
                <ascending>false</ascending>
                <urlCode>p</urlCode>
        </sorter>
        <sorter>
                <fieldName>geo_distance</fieldName>
                <ascending>true</ascending>
                <urlCode>r</urlCode>
        </sorter>

        <sorter>
                <fieldName>name</fieldName>
                <ascending>true</ascending>
                <urlCode>n</urlCode>
        </sorter>
        <sorter>
                <fieldName>name</fieldName>
                <ascending>false</ascending>
                <urlCode>m</urlCode>
        </sorter>
        
        
</sorters>
